Текст;Беспорядок
Ты забыл купить в магазине курицу;Курицу мне ты купить забыл в магазине
Я хочу поздравить тебя с днем рождения;С днем рождения хочу поздравить вас
Хотите приобрести новый телефон;Приобрести новый телефон не хотите ли вы
Бабушка опять заставляет меня есть гречку;Гречку бабушка заставляет меня вновь есть
Я сейчас сгенерирую текс йоды;Текст йоды сгенерирую я сейчас
Заходит в бар американец русский и немец;Американец немец и русский в бар заходят
Главный патриот российской федерации;Федерации российской патриот главный
